0,"Chicken Tenders","Yummy Tenders with ranch, deepfried, breaded, its lit",1,1,1,"344+cup+grgegreg|12+cup+chicken breast|234+cup+rgegergerg|6+cup+345345345gfdfgregger","Egg asdasdasd+Bread+Deep Fry+Yummy","Chikcen,ddepfreiod,fwefwef"
1,"Fried Teriyaki","idk if that even makes sense",1,9,9,234+cup+32324,cook,eat
2,"Testing recipes this is recipe name","this is the description",1,8,17,12+cup+chicken|1234+litre+peas|34+cup+mayo,"aaaaaa+then+aaaaaa+then WOOOOOOOOO","chicken,healthy,yummy"
3,beef,"first beef recipe",3,8,2395820395,"12+cup+beef|4+cup+lotsa time","cook it+make sure its not raw+eat","idk,beef?"
4,"Ginger Ale","canada dry wow so yummyu",1,9,8,"10+cup+ginger|10+cup+idk ale?","brew it+drink it",drink
5,"final test","testing description input",2,12352,13,12+galoon+ww|23+cup+223,Instructions?+idk+why+but+ok+,tags
